{
	"schemaVersion": "session-distill/v1",
	"status": "pass",
	"branch": "codex/agent-native-ratchets",
	"headSha": "1111111",
	"worktreeStatus": "dirty",
	"changedFiles": ["package.json"],
	"changedFileCount": 1,
	"evidenceLanes": [
		{
			"id": "worktree",
			"status": "dirty",
			"evidenceRefs": ["git status --short"]
		},
		{
			"id": "external_readiness",
			"status": "not_claimed",
			"evidenceRefs": ["ci", "review", "tracker", "merge"]
		}
	],
	"nextCommands": ["pnpm run coding-policy:route -- package.json"],
	"nonClaims": [
		"ci_passed",
		"review_resolved",
		"tracker_closed",
		"merge_ready",
		"validation_passed"
	],
	"claimBoundary": "session-distill/v1 orients resumed agents; it is not validation, CI, review, tracker, or merge readiness proof."
}
